{"schema_version":2,"id":"01M4NDJ1R7MGE4KD46SKNYNY7N","name":"jansen-small-6leg","notes":"Small FDM-printable Jansen walker (1 length unit = 2 mm). Motor-driven for bench tests.","linkage":{"params":{"a":38,"b":41.5,"c":39.3,"d":40.1,"e":55.8,"f":39.4,"g":36.7,"h":65.7,"i":49,"j":50,"k":61.9,"l":7.8,"m":15},"crank":{"x":"a","y":"l","length":"m"},"joints":[{"id":"K","centers":["G","C"],"radii":["b","j"],"side":1},{"id":"L","centers":["G","K"],"radii":["d","e"],"side":1},{"id":"M","centers":["G","C"],"radii":["c","k"],"side":-1},{"id":"N","centers":["L","M"],"radii":["f","g"],"side":-1},{"id":"F","centers":["M","N"],"radii":["i","h"],"side":1}],"foot":"F"},"walker":{"legs":6,"unit_m":0.002,"direction":-1,"body_mass_kg":0.35,"lateral_spacing_m":0.014,"body_length_m":0.25},"drive":{"kind":"motor","motor_omega_rad_s":2},"manufacturing":{"process":"fdm","material":"PLA","bar_width_mm":10,"bar_thickness_mm":3,"pin_diameter_mm":3,"clearance_mm":0.3,"layer_height_mm":0.2,"min_wall_mm":1.2,"bed_mm":[220,220]}}